{
  "version": "2026.08.01-v1",
  "source": "Original exercises authored for the LingoRoad MVP",
  "license": "Proprietary - LingoRoad educational use",
  "reviewer": "LingoRoad content review 2026-08-01",
  "lessons": [
    {
      "id": "lesson-a1-present-simple", "slug": "a1-present-simple", "title": "Present Simple Basics", "titleVi": "Hiện tại đơn cơ bản", "skillCode": "grammar.tenses.present_simple", "cefr": "A1", "order": 1,
      "items": [
        {"id":"item-a1-ps-01","type":"mcq","stem":"Lan ___ English every day.","options":["study","studies","studying","studied"],"correctAnswer":"studies","explanationVi":"Chủ ngữ ngôi thứ ba số ít dùng động từ thêm -s."},
        {"id":"item-a1-ps-02","type":"cloze","stem":"I ___ coffee in the morning. (drink)","options":[],"correctAnswer":"drink","explanationVi":"Với I, dùng động từ nguyên mẫu ở hiện tại đơn."},
        {"id":"item-a1-ps-03","type":"reorder","stem":"Sắp xếp thành câu đúng.","options":["usually","walk","I","to school"],"correctAnswer":"I usually walk to school","explanationVi":"Trạng từ tần suất đứng trước động từ thường."},
        {"id":"item-a1-ps-04","type":"mcq","stem":"My parents ___ in Da Nang.","options":["lives","live","living","is live"],"correctAnswer":"live","explanationVi":"Chủ ngữ số nhiều dùng động từ nguyên mẫu."},
        {"id":"item-a1-ps-05","type":"cloze","stem":"The shop ___ at nine. (open)","options":[],"correctAnswer":"opens","explanationVi":"The shop là ngôi thứ ba số ít."}
      ]
    },
    {
      "id": "lesson-a1-articles", "slug": "a1-articles", "title": "A, An and The", "titleVi": "Mạo từ a, an và the", "skillCode": "grammar.articles", "cefr": "A1", "order": 2,
      "items": [
        {"id":"item-a1-ar-01","type":"mcq","stem":"She is ___ engineer.","options":["a","an","the","no article"],"correctAnswer":"an","explanationVi":"Engineer bắt đầu bằng nguyên âm khi phát âm."},
        {"id":"item-a1-ar-02","type":"cloze","stem":"I saw ___ dog in the park.","options":[],"correctAnswer":"a","explanationVi":"Dùng a khi nhắc lần đầu một danh từ số ít."},
        {"id":"item-a1-ar-03","type":"reorder","stem":"Sắp xếp thành câu đúng.","options":["sun","the","is","hot"],"correctAnswer":"The sun is hot","explanationVi":"Dùng the với sự vật duy nhất như mặt trời."},
        {"id":"item-a1-ar-04","type":"mcq","stem":"Please close ___ door.","options":["a","an","the","some"],"correctAnswer":"the","explanationVi":"Người nói và người nghe đều biết cánh cửa nào."},
        {"id":"item-a1-ar-05","type":"cloze","stem":"He ate ___ apple after lunch.","options":[],"correctAnswer":"an","explanationVi":"Apple bắt đầu bằng âm nguyên âm."}
      ]
    },
    {
      "id": "lesson-a1-yes-no-questions", "slug": "a1-yes-no-questions", "title": "Yes or No Questions", "titleVi": "Câu hỏi Yes/No", "skillCode": "grammar.questions.yes_no", "cefr": "A1", "order": 3,
      "items": [
        {"id":"item-a1-yn-01","type":"mcq","stem":"___ you like music?","options":["Do","Does","Are","Is"],"correctAnswer":"Do","explanationVi":"Dùng Do với you ở hiện tại đơn."},
        {"id":"item-a1-yn-02","type":"cloze","stem":"___ she work here?","options":[],"correctAnswer":"Does","explanationVi":"Dùng Does với she."},
        {"id":"item-a1-yn-03","type":"reorder","stem":"Sắp xếp thành câu hỏi đúng.","options":["they","Are","ready"],"correctAnswer":"Are they ready","explanationVi":"Đưa động từ to be lên trước chủ ngữ."},
        {"id":"item-a1-yn-04","type":"mcq","stem":"Is Minh at home? — Yes, ___.","options":["he is","he does","is he","does he"],"correctAnswer":"he is","explanationVi":"Câu trả lời ngắn lặp lại động từ to be."},
        {"id":"item-a1-yn-05","type":"cloze","stem":"___ your friends play football?","options":[],"correctAnswer":"Do","explanationVi":"Friends là chủ ngữ số nhiều."}
      ]
    },
    {
      "id": "lesson-a1-some-any", "slug": "a1-some-any", "title": "Some and Any", "titleVi": "Cách dùng some và any", "skillCode": "grammar.quantifiers.some_any", "cefr": "A1", "order": 4,
      "items": [
        {"id":"item-a1-sa-01","type":"mcq","stem":"There are ___ bananas on the table.","options":["some","any","much","a"],"correctAnswer":"some","explanationVi":"Some thường dùng trong câu khẳng định."},
        {"id":"item-a1-sa-02","type":"cloze","stem":"We do not have ___ milk.","options":[],"correctAnswer":"any","explanationVi":"Any thường dùng trong câu phủ định."},
        {"id":"item-a1-sa-03","type":"reorder","stem":"Sắp xếp thành câu đúng.","options":["some","would like","I","water"],"correctAnswer":"I would like some water","explanationVi":"Some dùng trong lời đề nghị hoặc yêu cầu lịch sự."},
        {"id":"item-a1-sa-04","type":"mcq","stem":"Are there ___ questions?","options":["any","some","a","much"],"correctAnswer":"any","explanationVi":"Any thường dùng trong câu hỏi chung."},
        {"id":"item-a1-sa-05","type":"cloze","stem":"Could I have ___ bread, please?","options":[],"correctAnswer":"some","explanationVi":"Some phù hợp với lời yêu cầu lịch sự."}
      ]
    },
    {
      "id": "lesson-a1-family", "slug": "a1-family", "title": "Talking about Family", "titleVi": "Nói về gia đình", "skillCode": "vocabulary.family", "cefr": "A1", "order": 5,
      "items": [
        {"id":"item-a1-fa-01","type":"mcq","stem":"Your mother's brother is your ___.","options":["uncle","cousin","nephew","grandfather"],"correctAnswer":"uncle","explanationVi":"Uncle nghĩa là chú, bác hoặc cậu."},
        {"id":"item-a1-fa-02","type":"cloze","stem":"My father's mother is my ___.","options":[],"correctAnswer":"grandmother","explanationVi":"Grandmother nghĩa là bà."},
        {"id":"item-a1-fa-03","type":"reorder","stem":"Sắp xếp thành câu đúng.","options":["two","I","sisters","have"],"correctAnswer":"I have two sisters","explanationVi":"Cấu trúc have + số lượng + danh từ số nhiều."},
        {"id":"item-a1-fa-04","type":"mcq","stem":"A son and a daughter are ___.","options":["children","parents","couples","adults"],"correctAnswer":"children","explanationVi":"Children là dạng số nhiều của child."},
        {"id":"item-a1-fa-05","type":"cloze","stem":"My aunt's daughter is my ___.","options":[],"correctAnswer":"cousin","explanationVi":"Con của cô hoặc dì là cousin."}
      ]
    },
    {
      "id": "lesson-a2-past-simple", "slug": "a2-past-simple", "title": "Past Simple Events", "titleVi": "Sự kiện ở quá khứ đơn", "skillCode": "grammar.tenses.past_simple", "cefr": "A2", "order": 6,
      "items": [
        {"id":"item-a2-pa-01","type":"mcq","stem":"We ___ Hue last summer.","options":["visit","visited","visits","are visiting"],"correctAnswer":"visited","explanationVi":"Last summer là dấu hiệu của quá khứ đơn."},
        {"id":"item-a2-pa-02","type":"cloze","stem":"She ___ a new bag yesterday. (buy)","options":[],"correctAnswer":"bought","explanationVi":"Quá khứ bất quy tắc của buy là bought."},
        {"id":"item-a2-pa-03","type":"reorder","stem":"Sắp xếp thành câu đúng.","options":["did not","the bus","miss","I"],"correctAnswer":"I did not miss the bus","explanationVi":"Sau did not dùng động từ nguyên mẫu."},
        {"id":"item-a2-pa-04","type":"mcq","stem":"___ they arrive on time?","options":["Did","Do","Were","Have"],"correctAnswer":"Did","explanationVi":"Câu hỏi quá khứ đơn dùng Did."},
        {"id":"item-a2-pa-05","type":"cloze","stem":"He ___ tired after the trip. (be)","options":[],"correctAnswer":"was","explanationVi":"He đi với was ở quá khứ."}
      ]
    },
    {
      "id": "lesson-a2-future-forms", "slug": "a2-future-forms", "title": "Plans and Predictions", "titleVi": "Kế hoạch và dự đoán", "skillCode": "grammar.tenses.future_forms", "cefr": "A2", "order": 7,
      "items": [
        {"id":"item-a2-fu-01","type":"mcq","stem":"Look at those clouds. It ___ rain.","options":["is going to","will be","goes to","was going to"],"correctAnswer":"is going to","explanationVi":"Dùng be going to khi có dấu hiệu hiện tại."},
        {"id":"item-a2-fu-02","type":"cloze","stem":"I think people ___ live longer. (will)","options":[],"correctAnswer":"will","explanationVi":"Will dùng cho dự đoán mang tính ý kiến."},
        {"id":"item-a2-fu-03","type":"reorder","stem":"Sắp xếp thành câu đúng.","options":["meeting","are","tomorrow","We"],"correctAnswer":"We are meeting tomorrow","explanationVi":"Hiện tại tiếp diễn có thể diễn tả kế hoạch đã sắp xếp."},
        {"id":"item-a2-fu-04","type":"mcq","stem":"The phone is ringing. I ___ answer it.","options":["will","am going","do","am"],"correctAnswer":"will","explanationVi":"Will dùng cho quyết định ngay lúc nói."},
        {"id":"item-a2-fu-05","type":"cloze","stem":"They are going to ___ a house. (buy)","options":[],"correctAnswer":"buy","explanationVi":"Sau going to dùng động từ nguyên mẫu."}
      ]
    },
    {
      "id": "lesson-a2-prepositions", "slug": "a2-prepositions", "title": "Time and Place Prepositions", "titleVi": "Giới từ thời gian và nơi chốn", "skillCode": "grammar.prepositions", "cefr": "A2", "order": 8,
      "items": [
        {"id":"item-a2-pr-01","type":"mcq","stem":"The class starts ___ 8 a.m.","options":["at","on","in","by"],"correctAnswer":"at","explanationVi":"At dùng với thời điểm cụ thể."},
        {"id":"item-a2-pr-02","type":"cloze","stem":"My birthday is ___ May.","options":[],"correctAnswer":"in","explanationVi":"In dùng với tháng."},
        {"id":"item-a2-pr-03","type":"reorder","stem":"Sắp xếp thành câu đúng.","options":["on","is","the desk","The book"],"correctAnswer":"The book is on the desk","explanationVi":"On diễn tả vị trí trên bề mặt."},
        {"id":"item-a2-pr-04","type":"mcq","stem":"We have a test ___ Monday.","options":["on","at","in","from"],"correctAnswer":"on","explanationVi":"On dùng với ngày trong tuần."},
        {"id":"item-a2-pr-05","type":"cloze","stem":"The bank is ___ the post office and the cafe.","options":[],"correctAnswer":"between","explanationVi":"Between diễn tả vị trí ở giữa hai nơi."}
      ]
    },
    {